"timestamp","Host","severity_name","severity","description","cmdline","files_written","entities"
"2025-03-28T15:15:18.846Z","10.0.7.11","High","70","A process gathered identifying information about other network systems. Adversaries can use remote system information to attempt lateral movement. Review the process tree.","""cmd.exe"" /C net group ""Domain Admins"" plumber /add /y > C:\Windows\Temp\chzzGYqW.tmp 2>&1","",
"2025-03-28T15:15:18.846Z","10.0.7.11","Medium","50","A process has scheduled an unusual task. Some malware schedules tasks to maintain persistence. If this task unexpected, review it.","""cmd.exe"" /C net group ""Domain Admins"" plumber /add /y > C:\Windows\Temp\chzzGYqW.tmp 2>&1","",
"2025-03-28T15:14:59.391Z","10.0.7.11","Medium","50","A process has scheduled an unusual task. Some malware schedules tasks to maintain persistence. If this task unexpected, review it.","""cmd.exe"" /C net user plumber TestGeslo123! /add /y > C:\Windows\Temp\eyLjUKzR.tmp 2>&1","",
"2025-03-28T15:00:54.88Z",,"Informational","10","An endpoint received new privileges",,"",
"2025-03-28T14:56:16.807Z",,"Informational","10","An endpoint received new privileges",,"",
